0012e0ba095c2d75cdfc79b9c9e2a4e4a6781132	Variational bounds for mixed-data factor analysis
00273ef0af172a8ae02c59bf49a9b09c22cc68fa	Migration motif: a spatial - temporal pattern mining approach for financial markets
0029ba078e2903d149dd1e7f45c3f71d36ce729b	A network calculus for cache networks
004af6a1df10947ffa3eec7ceb0687c6c79db0a3	Constraint Management for Collaborative Electronic Design
0062526e2c87d1fd47388c13050cbc2871f766db	FireDroid: hardening security in almost-stock Android
00744271b1a9192e4bf4b8cb4b0ba915d827bb4c	Text categorization with many redundant features: using aggressive feature selection to make SVMs competitive with C4.5
0085c699cbf4323ff5d43818f382a8e9e4e832bc	Online Geometric Optimization in the Bandit Setting Against an Adaptive Adversary
00e17bd820ffdddfeca041f31ae1691d18f6970c	Temporal Phenotyping from Longitudinal Electronic Health Records: A Graph Based Framework
0114fb72afbd9cc0bca35940beb21eda596aa5e0	A Case for a Flexible Scalar Unit in SIMT Architecture
01eb1294d629e348673ad5212fc5eda61dbc8a27	Ordering of the RGB Space with a Growing Self-organizing Network. Application to Color Mathematical Morphology
0202a2cfc2a3e3ae82ea69781be100309f2325be	Where's the "Party" in "Multi-Party"? Analyzing the Structure of Small-Group Sociable Talk
024a6b8981750bbce913c8a8d13609be255944fd	Efficient, Correct, Unsupervised Learning for Context-Sensitive Languages
027fcf15d4741bde974a127207f28b031536eb1d	A Complete Declarative Debugger of Missing Answers
03617650a45a0a29590418d09390a36de3060569	Automatic Prediction of Parser Accuracy
03b31204f132962ac46a062fd7effeef8d90db6b	An Iterative Refinement Technique for Side Information Generation in DVC
042084570ea390686fbe62a00ef59282da67419c	Decision Making in Intelligent User Interfaces
05737e80116195486970bad275fe7a958d4a4bde	A Goal Oriented Approach for Modeling and Analyzing Security Trade-Offs
05f0324f90fe684926fa36a701fbc6b5045af898	Painless Labeling with Application to Text Mining
06fdfa00ea6a51aafa8fe305d2d69f4b46973892	Mining models of human activities from the web
072cae4f4da9d9e810fcb30899a52954c04ccab7	A Flexible Model for Resource Management in Virtual Private Networks
075fe9b777adae7e59e125283ce3960f38e7257c	Saturated Semantics for Reactive Systems
07c09fd623e4f93752f8809e1ae0b02b9c251ca0	Adult Learner Perceptions of Affective Agents: Experimental Data and Phenomenological Observations
08245b3e5e1ee8d52d3311e22f8def725f3cd1c6	Boom chameleon: simultaneous capture of 3D viewpoint, voice and gesture annotations on a spatially-aware display
0876622f6c7a068794d78aabdddf1e173137aa49	Cryptography with One-Way Communication
089ad394f9e0463c2f12e3d3cfbe8485485e6897	A Finite Element Method for Elastic Parameterization and Alignment of Cortical Surfaces Using Sulcal Constraints
08b8d9c9576a02c6efc5e8bf70b7ad6972973cda	When NMDA Receptor Conductances Increase Inter-spike Interval Variability
08bc6fbb08945c35ec8e989df0ce05c98b09668b	Implementation and Performance Evaluation of M-VIA on AceNIC Gigabit Ethernet Card
08f624f7ee5c3b05b1b604357fb1532241e208db	Segmentation and Recognition Using Structure from Motion Point Clouds
091621da1f4373b6d6f20a5024b729c43a1ae986	Measuring similarity between curves on 2-manifolds via homotopy area
09437d40dc213ba1a942b233c37d447337f5c056	Generalized simultaneous registration and segmentation
09e88460a9379a6cd979b3954f8c4d3bbb9de0dc	Evaluating Abductive Hypotheses using an EM Algorithm on BDDs
0a395aa2965bcfeaa860c967971e5cb6c89bc035	Robot Stereo-hand Coordination for Grasping Curved Parts
0a86a047d18cd011dd8df23aad5bb42cf99cc941	Learning cross-document structural relationships using boosting
0ab9dc7290e2ba31028a535d19b66dc02aa492c5	GMM-based SVM for face recognition
0ad6ed8cc5e5a3d26e047f0c9478fd06f327da3b	Metrics for Controlling Effort During Adaptive Maintenance of Object-Oriented Systems
0b225be92ba6aeb9b417eebf63f0e4a33c5cfe27	An optimal approach to the task allocation problem on hierarchical architectures
0b824c4ffe362bf2f8987232c9b5a8eb72f96f3b	Hybrid in-database inference for declarative information extraction
0b8ecf769bfefc5daa0ca2cc2c8b097bf34c90a6	A smoothed boosting algorithm using probabilistic output codes
0c45f23551a88db06af891dcdc633317fa64bc88	Predicting saliency using two contextual priors: The dominant depth and the horizon line
0caf94d184087e175245540a54cb10c16a4745fe	A Convex Optimization Framework for Bi-Clustering
0cb49416099ba101c5fcb3eb6c957d45e106195a	All Secrets Great and Small
0cc37453fbc8297cc797bba5fb79abb2f0d1eded	Novel Progressive Region of Interest Image Coding Based on Matching Pursuits
0d07b9746c3862b6263037ee405e4f7fcd6d51f6	On Bin Packing with Conflicts
0dda151030cd64198497ddfefd324fc1b57779d1	Reasoning About Actions in Narrative Understanding
0df395aa3e8c3ab10be1fee425b02782ed575d29	From Algorithmic to Subjective Randomness
0e43f60727382032a620d3c08694c0a104005de3	OACerts: Oblivious Attribute Certificates
0e59c60eaee54e0db8171b5a2be12833c5cdf2ca	A Cyclic Weighted Median Method for L1 Low-Rank Matrix Factorization with Missing Entries
0e74a1690b540a45f864f933d89a1273446710ff	Image retrieval with relevance feedback: from heuristic weight adjustment to optimal learning methods
0e797d2c7163a77106bc0f4ab1cea76bb86cfd92	Cooperative Computing for Distributed Embedded Systems
0e9806432739fb799a32acd49853d37c324bac03	Geometric Driven Optical Flow Estimation and Segmentation for 3D Reconstruction
0eccc4496649f2c86a6d836c3ced3e36428af5e1	Laplace Propagation
0f8f492fb900141d88e0ddcf239107c6a2a27b42	Distributed task migration for thermal management in many-core systems
104f123a189fe58cd4e05335215cbfb073468079	Concurrent Imitation Dynamics in Congestion Games
10a5765bd6efd776ea03084e6597b8de8cbcc6ae	Power modeling and architecture evaluation for FPGA with novel circuits for Vdd programmability
10ab7743b6aebea3fa6a2b73809a1586b9d956c2	Pricing, competition and innovation: A profitable business model to resolve the tussle involved in peer-to-peer streaming applications
10d93f66a7bd213bd91d5ed48ec51c185275e4ad	Coalition formation in proportionally fair divisible auctions
113cf3a6c3b95943c8667b5fd0a6346f95c5b25c	Dynamic Voting for Consistent Primary Components
12468e58d3a145449afc973c9f7b521a847c8a76	Using Information-Theoretic Measures to Assess Association Rule Interestingness
12aced95ba4026bcd651e844a600150d92e18e58	A Hybrid Rule-based System: How Variables are Involved in Connectionist Rule-based Systems
12b1a4fff4f7def7f0e40aa0b0413ccec4e6b453	Domain Transmutation in Constraint Satisfaction Problems
12d037436e39a3ea8bf46f3ceb7a7078c8e7c73d	Event detection in tennis matches based on video data mining
12e1edc7a1775a764ab03aead7522c40b43963f8	Locality-Aware Process Scheduling for Embedded MPSoCs
12facc1309f486a541d721134b2aaedc00570235	Spatial and Probabilistic Modelling of Pedestrian Behaviour
131870be9d65a2c43502870d18a603d4f64139e1	An algorithm for detecting multiple salient objects in images via adaptive feature selection
133955a22d7531b8658aa5830c02736be4f43b65	Towards Optimal Resource Utilization in Heterogeneous P2P Streaming
1345349908904a0736a5849db3e4d924371052a7	Fighting fire with fire: modeling the datacenter-scale effects of targeted superlattice thermal management
134fc2bb80a4521da5cedfb1fcd5901791c6f011	Automatic generation of personalized music sports video
136744ee008dc534b4048337e76ff182ecdc1214	Optimization of passenger car design for the mitigation of pedestrian head injury using a genetic algorithm
147856e2a691489587efaa982468e7040c017b1c	PID Controller Tuning for Stable and Unstable Processes Applying GA
14a3304a40d6ef79e082055e7455d3c3de8b3dcf	Capturing Global and Local Dynamics for Human Action Recognition
153ea7038a52eb81b85d4ca66c754bf727ca6406	An algorithm for finding novel gapped motifs in DNA sequences
158cda9abd6e7a13318151503ee65407d7fd180a	A Systematic Statistical Analysis of Ion Trap Tandem Mass Spectra in View of Peptide Scoring
1597a40368c48f3da5d82ee584e0dec3b618df06	Removing concurrency for rapid functional verification
15e38e34b3360f59a33a06be63b7f73457915da5	Real-time verification of network properties using Atomic Predicates
1604bdf9a49a98a39218f909ee766a913c7a4721	Graph Invariants as Necessary Conditions for Global Constraints
1677d29a108a1c0f27a6a630e74856e7bddcb70d	Efficient Misalignment-Robust Representation for Real-Time Face Recognition
16aeeae61701c74fdb3b560ec1ba7eef086bb4ce	Multimedia content protection via biometrics-based encryption
16c5fb6ff8dd31eac9cb7e4a6881f592f2758b16	Learning a Small Mixture of Trees
16c8bc97a022637ba53bab8be1b815a02e26b561	A Primal-Dual Randomized Algorithm for Weighted Paging
16f93683743c13c8ce3e6c9b0475f23832bb0754	The [Wikipedia] World is not flat: on the Organizational Structure of Online production Communities
17283370adbedf8bca327ce4e43ccaf9182f3c0d	Multiresolution Analysis of 3D Images Based on Discrete Distortion
176600b839d1f198831b1d43938f483784abb420	Improving the Effectiveness of Time-Based Display Advertising
17672157ae97ca104c956ad1a6312b71bd8ad038	Fast computation of generalized Voronoi diagrams using graphics hardware
178eceeae8aed820b789d7b5e4e2ddd1cfa7c557	A memetic algorithm for the low autocorrelation binary sequence problem
17b6ef93649bfe4c273b531028ee4550fbc5ac0a	Cross-Domain Sparse Coding
180b6f72a143c218f84d675fe42dc0d2b3e0152e	2-Compromise Usability in 1-Dimensional Statistical Databases
1820869030fca660212fb7a6449b6ad1aa99d9db	Adversarial memory for detecting destructive races
18879a57e4f01b6f7f642a99c72d82907e78fe94	Affinity learning on a tensor product graph with applications to shape and image retrieval
197e2e4d2992484435b5323649668b10a9cce0a2	Using Dynamic Asynchronous Aggregate Search for Quality Guarantees of Multiple Web Services Compositions
1990afd6d3c11cc6b7b9e272b3fe43dc8aed3138	Plan switching: an approach to plan execution in changing environments
19c94455ca5015a8a25e89ede1b6418645b57912	Direct and Indirect Effects of Sequential Treatments
19e851f2c61ffece4e5fada6deac7fecddd8792f	Model-based compression in wireless ad hoc networks
1a73a8e958cde8e96be43f94bca50b196b07d595	Implication of MAC Frame Aggregation on Empirical Wireless Experimentation
1a9eb04b9b07d4a58aa78eb9f68a77ade0199fab	Actions as Space-Time Shapes
1aadad3872f7fe564a98a3d9205ba3c329594075	An incentive mechanism for message relaying in unstructured peer-to-peer systems
1ab75f37d1ee196f1c1087fc95af79216ba826fe	Capacity of Structured Multilayer Networks with Shared Weights
1aede27149f28f7590ca1b8ee8f926e7477cd5d4	Regular Path Queries on Large Graphs
1b802ca0a6dd56e8ebec34d16511cd83f8ef917d	Update Operations: A Review
1bca65a562c74e7b8012f8501b6ba0bff15e869a	Bridging vision and commonsense for multimodal situation recognition in pervasive systems
1c14996f9cbb1ea09f5dae69215a5ffe21a21ad9	Business performance and enterprise resource planning
1c222c9e0f65068bfc20620bc89f597ead4ecb0d	Interactive Steering of Mesh Animations
1c5714e75442b9d95d257e7a4349aabb1434417d	Automatic Determination of Communication Topologies in Mobile Systems
1c734e6116ae58f33585aaa95833b166c7bc3372	Algorithms for the Database Layout Problem
1c9f5134541064c99075f7a04155c5abe8d19956	On Local Symmetries And Universality In Cellular Autmata
1d10b433f7ba603c764f0d372694e685d6696ee0	A Novel Relational Learning-to-Rank Approach for Topic-Focused Multi-document Summarization
1d69c28148bf39bcd3d0e0a92000ecee57c279ae	The Impact of Distractions on the Usability and the Adoption of Mobile Devices for Wireless Data Services
1d84bdc5b236a10c557d16554efda4ae45ddf56c	Two-dimensional statistical test for the presence of almost cyclostationarity on images
1dfcb022f23cae23824032835fde88bd60f65f37	Configuring Conservative Mode Fairness Algorithm in Resilient Packet Rings
1e1788ccee8fa4a21fa58f339852767076dc6246	Parser Adaptation and Projection with Quasi-Synchronous Grammar Features
1e28589db62cfa8523da102491d680d38044fdf4	Voronoi Diagrams with a Transportation Network on the Euclidean Plane
1e6f61c574fad2460d06d6f52295922f5c99857a	A Generative Constituent-Context Model for Improved Grammar Induction
1eb854ce0539b6fd18dbba942f52a80a735f5c8e	Automatic text extraction from video for content-based annotation and retrieval
1ef01e7bfab2041bc0c0a56a57906964df9fc985	Question Answering over Freebase with Multi-Column Convolutional Neural Networks
1f37004245781d92f9cf3ae95a4fe0fd1899d3b3	Sizes of Minimum Connected Dominating Sets of a Class of Wireless Sensor Networks
1f88013b75261a07b756212bd94340fbee0a6d08	Locating high-density clusters with noisy queries
21729739e9b4c8ff55ddd31b427575319ecd4707	Automating component-based system assembly
21d3c4aeebf81e8b4c5edd7cf745b3867b2bdbce	When Security Games Go Green: Designing Defender Strategies to Prevent Poaching and Illegal Fishing
21d683dfe11e77949aede4e95f5260cb71ae2732	Personalized Prefetching for Manets
21e8a6135c8a0e470e85a7577f1c49e5f55da48d	A Video Watermarking Based on 3-D Complex Wavelet
2288515f75904bc3358f12319442fe643db57c24	Peeling potatoes near-optimally in near-linear time
22cf3081c679431714e8cbda55cd89c57678c3b8	b-Bit Minwise Hashing for Estimating Three-Way Similarities
23319dfe6652eb6bcdb678cb56ea3318443881f9	Using Eye-Tracking Data for High-Level User Modeling in Adaptive Interfaces
2347ff467d9748989e2b546f20f7c31ab61b8517	Unifying Framework for Fast Learning Rate of Non-Sparse Multiple Kernel Learning
240ea5cb0b741ad03df4b03c2f62ae5a5649f052	Automatic generation of embedded memory wrapper for multiprocessor SoC
24696299451806ac55ed4295256a2a011d2e4d30	Empirical investigation of search algorithms for environment model-based testing of real-time embedded software
24b79c8f36133a9c71d6c2eefab8f46535632157	Language-independent Probabilistic Answer Ranking for Question Answering
250796f2fa80b2ea557f2728d7a0de5eb0124ab0	Robustness of Structurally Equivalent Concurrent Parity Games
25547f6e6a3c0955e84def318dbe574a9106be4a	Employing Batch Reinforcement Learning to Control Gene Regulation Without Explicitly Constructing Gene Regulatory Networks
2572e446e2bdaf72942219e9aa183ea96e14c642	A contrario hierarchical image segmentation
2586bee6e557fefe4153ea03c244d92102f7c118	Sound compilation of reals
25c03ff00d0bed4acaa690d570b7b013342317de	Analysis and mitigation of process variation impacts on Power-Attack Tolerance
25f808645ba8d15d3f0d680acd49b3487fc1891f	Approximate Learning of Dynamic Models
26364baae4556bd6c94bdb74409e9903286ef7c6	Universal Succinct Representations of Trees?
2649ad59de4f044248b36ce1ad33daeb98e3c7ca	The Cost of Traveling between Languages
2696009abd88223e8164f8c22bfafbd93531752e	Fine registration of 3D point clouds with iterative closest point using an RGB-D camera
26ad6c18609e0d4de3f5616fbd2b6928ab9b816e	DOLIB: Distributed Object Library
26bae4f8d04e8f195e3d468defad5b8cc4f945ef	Managing Alerts in a Multi-Intrusion Detection Environmen
26f96ba9abe554ff5e3c5a88e43ba36812ab7879	(Whose) value-sensitive design: a study of long- distance relationships in an Arabic cultural context
27105937da25fbc516322ebbe30236f509514e0d	Improving Arc Detection in Graphics Recognition
280c5037a7f859eadf6501018b659b350503b209	Fault Tolerance Tradeoffs in Moving from Decentralized to Centralized Embedded Systems
28866d360849ea5c00f79c8f58872de3b7aaeaff	CoSenS: A collecting and sending burst scheme for performance improvement of IEEE 802.15.4
2888efc8858ff1cfb004624a4228e5ace1271dc6	Bitplane intra coding with decoder-side mode decision in distributed video coding
28f5ffde6c7e9d53775c3cbecd3d1aee65fe8abb	Photo and Video Quality Evaluation: Focusing on the Subject
2920674386f1d59a4298437d54582e7c41aa72a1	How to Compare Treebanks
29ab1fb317559718bc468727369bb37ed91d972d	ligDB - Online Query Processing Without (almost) any Storage
29b6a897e8ef4f9c48b6c847bbef2eabd4506678	Direct egomotion estimation
2a457c79b12c01d480e3eca359f08a804a858d27	Query Co-Processing on Commodity Processors
2b370d4e52a64de17c0c4dd3e3bc7fbcbf006c50	Disjunctive Semantics based upon Partial and Bottom-Up Evaluation
2ba266b79d833cdfe4f8d16da6c6c10f6b2935c7	Characterizing Definability of Second-Order Generalized Quantifiers
2bf5cd5de7244861ed14e1cd104902e58b7b43a6	Two-Phase Modeling of QoS Routing in Communication Networks
2c31df0855cd391e709cebd98e372a3655255f25	Topic 5: Parallel and Distributed Databases
2c3b294dbdd5a4b5a913aef37b25147e03d45d91	A document centric approach for supporting incremental deployment of pervasive applications
2c422c9ce4b0c609584ec6f9bc43c5ddd87f86e1	Model Checking Knowledge in Pursuit Evasion Games
2cc9e6d894c156faadafe4d75ef9c3e5ae7c8cd3	Redo Recovery after System Crashes
2d15f14ef0a23331cba9494144365ded913e5dc3	The store-load address table and speculative register promotion
2da10ae0b05eeb5d2c8c41c39c8842fce75a8d1a	PatchMatch Based Joint View Selection and Depthmap Estimation
2e24efd1d26dae508b34827b7f9e5bb92fc6f3b0	Kernels for Semi-Structured Data
2e3308a0eb078b9b9f6f23470e9b90f371e64642	On Exploiting Cooperative, Channel and Multiuser Diversities in Wireless Relay Networks
2ea9a631563554591dac4639aaffe157d775a150	Curvature Measures of 3D Vector Fields and their Applications
2ebf08944768caf4e15ae844a763d9994939452c	Staying Under The Radar: Innovation Strategy In Information Infrastructures For Health
2ec2f8cd6cf1a393acbc7881b8c81a78269cf5f7	Learning Image Embeddings using Convolutional Neural Networks for Improved Multi-Modal Semantics
2ed5c8221097abf41069431f108626f6be791120	Nonvolatile memristor memory: Device characteristics and design implications
2f61cab6dc6246fb12be86752aa1d62173f4733f	Symbolic Reliability Analysis and Optimization of ECU Networks
2feb97bd391ef89f65105330b18724e0086d8aa8	Approximation Schemes for Packing with Item Fragmentation
3004e39a7e3139b3094e09c8b3b474a647f270bb	Segmentation-driven perceptual quality metrics
3074cffbb72923b6229fc72fd5814e1d09de1290	Performance Analysis of Wireless MAC Protocols Using a Search Based Framework
3077a41befe3d30e0f348076c1122ef307fa62f0	2D Observers for Human 3D Object Recognition?
309fbeaa395906cd5c5554f8e3b5742f17656a22	Shake before building: replacing make with haskell
315163d3559fc3e298f9b190028d86fe83bdf62f	Multiobjective evolutionary algorithms for dynamic social network clustering
31a6424107ddbc18e12f2722e2c72a93f75cd5e7	Variability Driven Gate Sizing for Binning Yield Optimization
31c12a7b0f374303c472d1d9fbd656e41e938cac	Integrated Admission and Congestion Control for QoS Support in Clusters
31dbd5a56e35a14eb556637a2124207c725bcac6	Gradual transition detection using color coherence and other criteria in a video shot meta-segmentation framework
322e8b627d89fd082903af8979f335ac24b27271	Scaling up dynamic time warping for datamining applications
323f596b85a35bce45eac65ff4855e08fcdaa31d	Toward a Programming Model for Service-Oriented Computing
3282cb4b9ec1cda352cc5ed4aa7fcfa9a60b424b	Best-First AND/OR Search for Graphical Models
32d9aa752afd5242b39b2d288fd9831b60688c4a	Colouring graphs when the number of colours is nearly the maximum degree
32e2d061edf1ea7d88d95b6cee92f7443210c825	Where has my battery gone? Finding sensor related energy black holes in smartphone applications
3332653e7f019abd4ce05818db016f40a085ba89	Optimizing Bandwidth Constraint through Register Interconnection for Stream Processors
33c171926c708b876cc75e84f64bd3a18ea4fbb9	Leakage and temperature aware server control for improving energy efficiency in data centers
33d4973a85f8e87c180952cbcdff6ec695022e0d	Seeking legitimation for an information system: a preliminary process model
34050164c3f3c29101ad38773ec359c058b08724	Document Image Matching Based on Component Blocks
34e21cbfcd1fdbd1f5964fc59db6941a3c740791	Integrating history-length interpolation and classes in language modeling
35c672105950bd4b139322355c923f908791afbb	Delay asymptotics with retransmissions and fixed rate codes over erasure channels
35d7d4a497bf586a0323893939b015db91ffe86a	PORT: a Precision-Order-Recall MT Evaluation Metric for Tuning
35f6c6ff65cb188f0d840b1ca45b5d0bcf9d18bc	Broadcasting in sensor networks: the role of local information
36149815ffb308c6a421dc8e978dc202eb0d91c9	Analysis of the O-GEometric History Length Branch Predictor
366954363c99333612013ca283ff9640229a0f41	Nonlocal Spectral Prior Model for Low-Level Vision
3697307709b52af113469831457f3525d389c7cd	Hybrid transactional memory
369a71e89e0890ee32be7886e9d530afd2745e4b	Open Problem: Learning Quantum Circuits with Queries
36dc33ae32344c825eab1c985fe1e5be3d5a2ed2	Load scheduling: Reducing pressure on distributed register files for free
37748c3146850fbf4593599b4073d7515ebe90a2	Multi-agent based peer-to-peer information retrieval systems with concurrent search sessions
38082288fb2adcc509484b477c93953a5946b378	Automatic Emotional Degree Labeling for Speakers' Anger Utterance during Natural Japanese Dialog
3885c7d8c0155d3905f4a0a3997c0cd28c7a649b	Mapping Heterogeneous Distributed Applications on Clusters
39858e68fad6a18befcab7bf591c4a196f009e40	Efficient Application Representation for HASTE: Hybrid Architectures with a Single, Transformable Executable
39e3e3fa790862b4ba8dcf6c9fd0467560b868ae	Types and Subtypes for Client-Server Interactions
3a717bf3e190bbe7a5788fed67f7c069fef11e37	A Phonetic-Based Approach to Chinese Chat Text Normalization
3ad6d5c0ce7c5b9cf56afeab77a8ce5a4a531290	P Systems with Adjoining Controlled Communication Rules
3aecaacf17f3e5b1eaab9071119c8dfd34e16eeb	Links among Impossible Differential, Integral and Zero Correlation Linear Cryptanalysis
3af3de384e0c5ccf95fd5aaf8470340f95284cd4	Meta-design: Expanding Boundaries and Redistributing Control in Design
3b05cef0b2ebbe5acc1e670c411dca5c8f511a70	Enforcing High-Performance Operation of Multi-hop Wireless Networks with MIMO Relays
3b0d2ab0a7ce9fa97cb7470b904055f3b81fc73a	Transition-Based Parsing with Confidence-Weighted Classification
3d276b81608d8bfae4b780067e66eb336e301d2f	Services for Knowledge Resource Sharing & Management in an Open Source Infrastructure for Lifelong Competence Development
3d9add004b34e79629f321724285f7f80e329d9d	Dynamic adaptive techniques for learning application delay tolerance for mobile data offloading
3da7b8c620e1ec58c5ab1086ed2e718a30079b55	Testing the Quality of Manufactured Disks and Cylinders
3dd580aba9d264512d7fb256d42f8fc87dd6df16	Recognizing activities with cluster-trees of tracklets
3ed3723101dee44bd86ffec962fe2eaa9b163ef0	Attack for Flash MIX
3f2a902b9a08f4e3438e82669e06fa2b202c4a7a	Self-stabilization versus Robust Self-stabilization for Clustering in Ad-Hoc Network
3f9dec10307af8648608468defd9867a88c5dc59	Panther: Fast Top-k Similarity Search on Large Networks
3fd7fe70aaa07478c8692d1bed5c8aec675e443a	Focus in Catadioptric Imaging Systems
3ffcda598d647dd5cfb8402e177a4fa423817c68	Auto-Regressive HMM Inference with Incomplete Data for Short-Horizon Wind Forecasting
400dca736b1571bb9399e0b0ccdce8e165ae37ff	Recording the region of interest from FlyCam panoramic video
404a7bb70a535de4ac3edf79543f00293523d486	Toward Learning and Evaluation of Dialogue Policies with Text Examples
40d9b6e9cd54f067f7f37bbe5c8042e24bed59e0	Reconstruction of 2D Pet Data with Monte Carlo Generated Natural Pixels
40dd192739e7c7766f0078ae2f4f726eea98194b	Interpolation-based Q-learning
40e91979fc4df055a1844f8db9768f70ff35d69f	Query Automata
416ac0fd80fc1c2bbbf6322612b254e68787a29e	Location Update Generation in Cellular Mobile Computing Systems
41b481b811dfe0d42d72b55eca00bf0303ef32ae	Meeting the Embedded Design Needs of Automotive Applications
41fd083e0779d59a7c587ae42232c526c8efa2fb	BOSS: Beacon-less On Demand Strategy for Geographic Routing inWireless Sensor Networks
42b845dd0a08ca7ef97dc5151e47b83169594fc4	TOM: Topology oriented maintenance in sparse Wireless Sensor Networks
430cf582155ee8f0638b3c811d324c6dbe7e7268	A near Optimal Amplify and Forward Relaying in Two-Way Relay Networks
43a69c96e75be147d11ab023e68c229ed4095a8a	Collabohab: A Technology Probe into Peer Involvement in Cardiac Rehabilitation
43c12359f26b52bee73ea5455dfc4b82325684a3	Teaching graphs to visually impaired students using an active auditory interface
4437d5060cbc36c83bebbc499438c8c6141143de	Topology abstraction as VPN service
44415a22ffb1e4b0471433fb6326503af500817b	Accelerating the Whirlpool Hash Function Using Parallel Table Lookup and Fast Cyclical Permutation
44e178378b2f3a159328bfb4b43adef346eb6aed	Field-Programmable Learning Arrays
44ff45665a3aff99c7217266fdda44cc4c752780	An Algorithm for Playout of Packet Voice Based on Adaptive Adjustment of Talkspurt Silence Periods
450dcb127df546d73710701560b64d984382fef2	SURF: detecting and measuring search poisoning
454c38a35d1e8527faa3e99473b5e6a9e00ab148	Optimizing the Computational Lexicalization of Large Grammars
45d04a0a38c63b2514db70dc9d3f5a1b457ad87d	Loading a Cache with Query Results
466b0e6cbbd284eaabe11e6386949c332b4f488e	Anaphora Resolution in Slot Grammar
46b26e68c5e5074562d5c280bb29dde7c57bad7d	Learning Features for Object Recognition
470b1fd2552c29df1723a4d34d267779797cf869	Application-specific compression for time delay estimation in sensor networks
472b8c1549ac8483fdc9e6762cf975400e2e0b81	Pluggable abstract domains for analyzing embedded software
4746e63e4569c4b46b7c9f7bffbc0fee0816f16c	Including User Strategies in the Evaluation of Graphic Design Interfaces for Browsing Documents
47782882d1c795fbc00c483c22a53b44f9640353	Incremental updating of advanced correlation filters for biometric authentication systems
4793c8a7a11bf42cc93ba2513e23b82f6fb589c5	Fast Garbling of Circuits Under Standard Assumptions
484d68c064373a95ac8460627812b0d5102462db	Reliable transmission over covert channels in first person shooter multiplayer games
4863fadc066236cd92e29db0ae4b5e21fd8dc47e	Knowledge Engineering Approach To Morphological Analysis
4866aeb852ab93fe14e78c6709715a984f6fd8e4	Equal gain transmission in multiple-input multiple-output wireless systems
48e196b9be7ac0f37d510e9f9536d5cc33a978d1	Maintaining Alternative Values in Constraint-Based Configuration
49f9053a38b340a0dc34ba66904aaa3191fd07de	Temporal Constraint Networks in Action
